{
  "$schema": "https://centreon.github.io/centreon-plugins/rs-collections/snmp/v0/rs-collection.schema.json",
  "format_version": 0,
  "collect": {
    "snmp": [
      {
        "name": "memTotalSwap",
        "oid": ".1.3.6.1.4.1.2021.4.18.0",
        "query": "Get"
      },
      {
        "name": "memAvailSwap",
        "oid": ".1.3.6.1.4.1.2021.4.19.0",
        "query": "Get"
      }
    ]
  },
  "compute": {
    "metrics": [],
    "aggregations": [
      {
        "name": "swap.free.bytes",
        "value": "{memAvailSwap} * 1024",
        "uom": "B",
        "min": 0,
        "max_expr": "{memTotalSwap} * 1024",
        "threshold-suffix": "free-bytes"
      },
      {
        "name": "swap.usage.bytes",
        "value": "({memTotalSwap} - {memAvailSwap}) * 1024",
        "uom": "B",
        "min": 0,
        "max_expr": "{memTotalSwap} * 1024",
        "threshold-suffix": "bytes"
      },
      {
        "name": "swap.usage.percent",
        "value": "100 * ({memTotalSwap} - {memAvailSwap}) / {memTotalSwap}",
        "uom": "%",
        "min": 0,
        "max": 100,
        "threshold-suffix": "prct"
      },
      {
        "name": "swap.total.bytes",
        "value": "{memTotalSwap} * 1024",
        "uom": "B",
        "min": 0
      }
    ]
  },
  "output": {
    "ok": "OK: Swap Used: {aggregations.swap.usage.bytes}B - Free: {aggregations.swap.free.bytes}B - Total: {aggregations.swap.total.bytes}B",
    "warning": "WARNING: ",
    "detail_warning": true,
    "critical": "CRITICAL: ",
    "detail_critical": true,
    "instance_separator": " - ",
    "metric_separator": ", "
  }
}
