{
  "$schema": "https://centreon.github.io/centreon-plugins/rs-collections/snmp/v0/rs-collection.schema.json",
  "format_version": 0,
  "collect": {
    "snmp": [
      {
        "name": "sysDescr",
        "oid": "1.3.6.1.2.1.1.1.0",
        "query": "Get"
      }
    ]
  },
  "compute": {
    "metrics": [],
    "aggregations": []
  },
  "output": {
    "ok": "OK: Host check successful"
  }
}
