{
  "$schema": "https://centreon.github.io/centreon-plugins/rs-collections/snmp/v0/rs-collection.schema.json",
  "format_version": 0,
  "collect": {
    "snmp": [
      {
        "name": "inodes",
        "oid": "1.3.6.1.4.1.2021.9.1",
        "query": "Walk",
        "labels": {
          ".2": "path",
          ".3": "device",
          ".10": "percent_used"
        }
      }
    ]
  },
  "compute": {
    "metrics": [
      {
        "prefix": "{inodes.path}",
        "name": "inodes.usage.percent",
        "value": "{inodes.percent_used}",
        "uom": "%",
        "min": 0,
        "max": 100,
        "threshold-suffix": "inodes"
      }
    ]
  },
  "output": {
    "ok": "All inode partitions are OK",
    "detail_ok": false,
    "warning": "WARNING: ",
    "detail_warning": true,
    "critical": "CRITICAL: ",
    "detail_critical": true,
    "instance_separator": " - ",
    "metric_separator": ", "
  }
}
