{
  "$schema": "https://centreon.github.io/centreon-plugins/rs-collections/snmp/v0/rs-collection.schema.json",
  "format_version": 0,
  "collect": {
    "snmp": [
      {
        "name": "storage",
        "oid": "1.3.6.1.2.1.25.2.3.1",
        "query": "Walk",
        "labels": {
          ".2": "type",
          ".3": "description",
          ".4": "allocation_units",
          ".5": "size",
          ".6": "used"
        }
      }
    ]
  },
  "compute": {
    "metrics": [
      {
        "prefix": "{storage.description}",
        "name": "memory.usage.percent",
        "value": "100 * {storage.used} / {storage.size}",
        "uom": "%",
        "min": 0,
        "max": 100,
        "threshold-suffix": "prct"
      },
      {
        "prefix": "{storage.description}",
        "name": "memory.usage.bytes",
        "value": "{storage.used} * {storage.allocation_units}",
        "uom": "B",
        "min": 0,
        "max_expr": "{storage.size} * {storage.allocation_units}",
        "threshold-suffix": "bytes"
      }
    ],
    "aggregations": [
    ]
  },
  "output": {
    "ok": "OK: ",
    "detail_ok": true,
    "warning": "WARNING: ",
    "detail_warning": true,
    "critical": "CRITICAL: ",
    "detail_critical": true,
    "instance_separator": " - ",
    "metric_separator": ", "
  }
}
